### ISSUE TITLE
Responder not Responding

### ISSUE THREAD

**Issue by z0kk** [lgandx/Responder#300]
So I'm pretty new to Responder and I have what very well may be a silly question. I run `Responder.py -I ens192`, which enables the LLMNR, NBT-NS, and DMS/MDNS poisoners and all of the default servers, including smb.

![Image](https://github.com/user-attachments/assets/1322cadd-c451-42d9-8df8-b7cd397c5d5f)

![Image](https://github.com/user-attachments/assets/e6582ca4-4189-48c0-8c6b-1164f22d00d4)

If I browse from my desktop (same subnet as Responder) directly to the responder server (e.g. `\\actual_hostname\anything`), responder grabs the hash. If I browse from my desktop to a fake host (`\\fakehost\anything`), responder doesn't do anything. However, as soon as I try browsing to the fake hostname, tcpdump running on the responder server shows three packets hitting the responder host from my desktop:

```
11:50:38.811772 IP 192.168.56.240.137 > 192.168.56.255.137: UDP, length 50
11:50:39.563543 IP 192.168.56.240.137 > 192.168.56.255.137: UDP, length 50
11:50:40.325680 IP 192.168.56.240.137 > 192.168.56.255.137: UDP, length 50
```

If I'm not mistaken, that's netbios name resolution traffic. So my question is why Responder doesn't...like...respond.

**Comment by lgandx** [comment]
I cannot reproduce this issue.

**Comment by z0kk** [comment]
Interesting...Is there anything you suggest I do to figure out what's happening in our environment?

**Comment by shikataNai** [comment]
your responder instance and your desktop are probably not layer two adjacent. This is an issue on your end.

**Comment by z0kk** [comment]
Yeah, weird...Both hosts are behind the same switch. I'll ask our networking guys to see if they can come up with anything. Although the responder host sees the NB-NBT traffic. At least that's what I'm assuming it is: it's sent to the broadcast address on port 137 as soon as I try to browse to a non-existent host. 🤷 . Thanks anyway.
